{
  "schema_version": "1.0",
  "current_kfk_version": "kfk-1.4.0",
  "versions": [
    {
      "version": "kfk-1.4.0",
      "status": "current",
      "validated_trust": 1.0,
      "validated_at": "2026-09-08T00:00:00Z",
      "evidence_feature_set": [
        "artifact-digest-verification",
        "source-freshness-evaluation",
        "citation-provenance-completeness",
        "contradiction-flagging"
      ],
      "supersedes": [
        "kfk-1.3.0"
      ],
      "review_reason": "Current governance-approved KFK manifest."
    },
    {
      "version": "kfk-1.3.0",
      "status": "supported",
      "validated_trust": 0.9,
      "validated_at": "2026-07-01T00:00:00Z",
      "evidence_feature_set": [
        "artifact-digest-verification",
        "citation-provenance-completeness"
      ],
      "review_reason": "Retained for reproducible evaluation of prior ERSI records."
    }
  ],
  "policy": {
    "version_lag_decay": 0.12,
    "age_decay_per_30_days": 0.015,
    "minimum_non_revoked_multiplier": 0.15,
    "unknown_version_multiplier": 0,
    "revoked_version_multiplier": 0
  }
}
